{
  "evidenceDigest": "sha256:293a771af237fb55901267d1a37f86e994f7bd5b0a52d604dd3452a3535522ad",
  "failureReceiptsRemoved": false,
  "formalHealthAccepted": true,
  "gatewayModelAccepted": true,
  "gatewayProcessUnchanged": true,
  "gatewayRestarted": false,
  "legacyExporterRetained": true,
  "listenerClosed": true,
  "listenerPort": 8780,
  "phiConsumerAccepted": true,
  "phiServiceRestarted": false,
  "previousPid": 133756,
  "releaseActivated": false,
  "releaseArtifact": "/opt/cloudx/releases/0.1.15/cloudx-cloud.pyz",
  "releaseVersion": "0.1.15",
  "rollbackSnapshot": "/var/lib/cloudx/http-importer-stop-prep/20260716T075313Z",
  "rollbackSnapshotRetained": true,
  "runtimeRemoved": false,
  "schema": "cloudx.http-importer-stop.v1",
  "selectorsUnchanged": true,
  "service": "codex-import.service",
  "serviceActive": false,
  "serviceEnabled": false,
  "sshImportDryRunAccepted": true,
  "status": "stopped",
  "tokenRemoved": false,
  "unitRemoved": false
}
